"Think Tank","URL","Country","Specializes In"
"Lowy Institute","lowyinstitute.org","Australia","Foreign policy, defense, Indo-Pacific; publishes Asia Power Indexatlanticcouncil+1"
"Observer Research Foundation (ORF)","orfonline.org","India","Global & Indian foreign/security policyreddit"
"Japan Institute of Int'l Affairs (JIIA)","jiia.or.jp","Japan","East Asian security, foreign policyreddit"
"Australian Institute of Int'l Affairs","internationalaffairs.org.au","Australia","IR analysisguides.library.georgetown"
"Institute for Defence Studies & Analyses (MP-IDSA)","idsa.in","India","Defense & strategic studiesreddit"